{
  "schema": "https://receiptprotocol.com/open-receipt/v0.2/issuer-metadata.schema.json",
  "issuer": "https://issuer.example",
  "metadata_version": 1,
  "issued_at": "2026-07-30T12:00:00.000Z",
  "next_update": "2026-08-30T12:00:00.000Z",
  "previous_metadata_hash": null,
  "keys": [
    {
      "kid": "example-evidence-2026-q3",
      "purpose": "open_receipt_evidence",
      "alg": "EdDSA",
      "public_jwk": {
        "kty": "OKP",
        "crv": "Ed25519",
        "x": "11qYAYKxCrfVS_7TyWQHOg7hcvPapiMlrwIaaPcHURo",
        "kid": "example-evidence-2026-q3",
        "use": "sig",
        "alg": "EdDSA"
      },
      "status": "active",
      "valid_from": "2026-07-01T00:00:00.000Z",
      "valid_until": null,
      "activated_at": "2026-07-01T00:00:00.000Z",
      "retired_at": null,
      "revoked_at": null,
      "revocation_effective_from": null,
      "compromised_at": null,
      "compromise_effective_from": null,
      "destroyed_at": null,
      "replaced_by_kid": null,
      "reason_code": null
    },
    {
      "kid": "example-metadata-2026-q3",
      "purpose": "issuer_metadata",
      "alg": "EdDSA",
      "public_jwk": {
        "kty": "OKP",
        "crv": "Ed25519",
        "x": "PUAXw-hDiVqStwqnTRt-vJyYLM8uxJaMwM1V8Sr0Zgw",
        "kid": "example-metadata-2026-q3",
        "use": "sig",
        "alg": "EdDSA"
      },
      "status": "active",
      "valid_from": "2026-07-01T00:00:00.000Z",
      "valid_until": null,
      "activated_at": "2026-07-01T00:00:00.000Z",
      "retired_at": null,
      "revoked_at": null,
      "revocation_effective_from": null,
      "compromised_at": null,
      "compromise_effective_from": null,
      "destroyed_at": null,
      "replaced_by_kid": null,
      "reason_code": null
    },
    {
      "kid": "example-log-2026-q3",
      "purpose": "issuance_log",
      "alg": "EdDSA",
      "public_jwk": {
        "kty": "OKP",
        "crv": "Ed25519",
        "x": "_FHNjmIYoaONpH7QAjDwWAgW7RO6MwOsXeuRFUiQgCU",
        "kid": "example-log-2026-q3",
        "use": "sig",
        "alg": "EdDSA"
      },
      "status": "active",
      "valid_from": "2026-07-01T00:00:00.000Z",
      "valid_until": null,
      "activated_at": "2026-07-01T00:00:00.000Z",
      "retired_at": null,
      "revoked_at": null,
      "revocation_effective_from": null,
      "compromised_at": null,
      "compromise_effective_from": null,
      "destroyed_at": null,
      "replaced_by_kid": null,
      "reason_code": null
    }
  ],
  "signature": {
    "kid": "example-metadata-2026-q3",
    "alg": "EdDSA",
    "value": "Wi-4nYVg2BL7tk-Hs1KaN42rHgpe8Ar2EiGbCFnlvc7vELLtYh17MQorcFe40iwUjeuk-aXMcXujYUg9bQoJBA"
  }
}
